,Proyecto,Autor(a),País,Descripción,Recaudación,Porcentaje,Vistas,Colaboradores,Categoría
494,SOBRESALTO,Grupo SobreSalto,Brasil,"Espetáculo Rosas de Noel do grupo musical SobreSalto, com estreia marcada para outubro, no Rio de Janeiro.",26973,104,1800,58,Artes escénicas
495,IMPRIMIR THE INDY!,Argentina Independent,Argentina,Queremos lanzar una publicación independiente y gratuita en inglés para dar una cobertura de calidad acerca de los asuntos argentinos.,124132,103,20400,75,Editorial
496,TEPOZTLÁN TIERRA DE MISTICISMO,AleBravo,México,Este proyecto busca recaudar fondos para imprimir la primera edición de un libro que busca difundir las maravillas de Tepoztlán.,112007,103,16500,55,Editorial
497,LIBRONGO 4,Robertita,Argentina,"Cuarta edición de Librongo: libro para colorear, para todo público, DONADO en gran parte a pacientes niños y adultos mayores",40268,103,11200,165,Editorial
498,LUPITA VERDE,Lupita Verde,Argentina,"Lupita Verde es una niña curiosa y alegre, que ama la naturaleza y la comida saludable. Tiene un mundo muy interesante y quiere compartirlo.",15271,103,18900,111,Editorial
499,MULHERES A BORDO - 30 ANOS DA MULHER NA MARINHA,HELENA MARIA PERES,Brasil,"Um livro que descreve como as mulheres pouco a pouco ganharam terreno nesse segmento profissional, antes restrito aos homens.",8331,103,4700,16,Editorial
500,CARD GAME MERCENARY CRUSADE,Alex Dates,Brasil,Impressão da 1º tiragem do jogo de cartas colecionáveis baseado nos personagens do quadrinho mais interessante da web!,16499,103,5300,38,Editorial
501,UN SANTIAGO CON HISTORIA,Jaime Lamarca U.,Chile,Los libros están en imprenta.Todo listo para su lanzamiento y se no acaba el tiempo cuando solo falta tu aporte,35179,103,2100,19,Editorial
502,RAMÓN EL OPTIMISTA,Ramón El Optimista,Argentina,Ramón el Optimista es un cuento infantil ilustrado que narra la historial del búho Ramón y sus amigos quienes nos dejarán una gran enseñanza,13497,103,7100,75,Editorial
503,"""ANIMALES DE PRIMERA"" EL LIBRO",Tristan Comics,Argentina,"Unite al equipo que busca editar el libro de humor sobre un universo que satiriza al fútbol, deporte que despierta nuestro lado más animal.",21994,103,11500,103,Editorial
504,DERROCANDO A ROCA,Derrocando a Roca,Argentina,Colectivo periodístico con una pagina web (derrocandoaroca.com) y un programa de radio en FM La Tribu 88.7. ¡Vamos por la cooperativa!,3366,103,5700,37,Editorial
505,PAULA CECCHI DIBUJOS PINTURAS,Paula Cecchi,Argentina,Será un libro que compile una selección de los dibujos y pinturas que hice en los últimos años,6781,103,7400,34,Editorial
506,CORTOMETRAJE,Nina Nino Producciones,Chile,"""La invitada"" es un proyecto de cortometraje de ficción producido por Niña Niño Producciones y Grita Medios, y dirigido por Roberto Doveris",14729,103,5900,23,Artes escénicas
507,LAMEDERO,Guillermo Ugalde,Chile,"""Lamedero"" es el segundo montaje de la compañía Teatro La Península y está inspirada en ""El licenciado vidriera"" de Miguel de Cervantes.",35465,103,3400,18,Artes escénicas
508,WAKE UP SUSAN,brenda,Argentina,"Wake up Susan es un obra que integra diversas artes: teatro, baile, música y visuales donde el humor se hace presente desde el comienzo.",2364,103,5300,195,Artes escénicas
509,LAS BUENAS MUERTES,Agustina soler,Argentina,El 17 de Marzo vamos a estrenar la obra de Gabriel Calderón. Necesitamos tu aporte para hacerlo posible. Gracias!!,2023,103,3500,13,Artes escénicas
510,EL BOSQUE ENCAPRICHADO,Ana Dolores Castro,Argentina,¡Ayudanos a llegar el 5 de Julio al Auditorio de San Rafael!,4065,103,7600,49,Artes escénicas
511,MENEA PARA MI (DANZA TEATRO),cumbi,Argentina,"Obra de danza de teatro de Cumbi Bustinza que habla de la vida en un barrio bajo. Amor, drogas, cárcel, familia, fé, amigos, muerte, sueños.",2707,103,11300,60,Artes escénicas
512,LAS LÁGRIMAS,Las Lágrimas,Argentina,"Ingrid Pelicori, Violeta Urtizberea, Iride Mockert, Martín Urbaneja y Fabio Aste protagonizan Las lágrimas, de Mariano Tenconi Blanco.",2703,103,7200,23,Artes escénicas
513,DILLINGER ( COMEDIA TEATRAL ),Compania Improvisa2,Argentina,"Somos Mariana ""Cumbi"" Bustinza ; Tomás Cutler y Gaby Gavila . Queremos concebir DILLINGER una comedia teatral y necesitamos tu ayuda!!!",4039,103,5500,57,Artes escénicas
514,PELOTERO VIAJA A COLOMBIA,Vivi Perea,Argentina,La obra del autor Gonzalo Marull interpretada por el Grupo Ross fue invitada al VIII Festival de Arte Femenino y vos podes colaborar,2026,103,2600,15,Artes escénicas
515,LA ESQUINA DE LA MODA,Alejandrinaq,Argentina,"COMEDIA TEATRAL DE AUTORÍA COLECTIVA. AMAMOS LO QUE HACEMOS, GRACIAS GRACIAS Y MAS GRACIAS POR AYUDARNOS A LLEGAR A LA META",5065,103,3300,26,Artes escénicas
516,BALADA MALANDRA,Producciones Independientes Rosario,Argentina,"Balada Malandra es un espectáculo teatral Rosarino, que se estranara en Rosario el 7 y 8 de Septiembre en el Auditorio Fundación.",10098,103,3700,14,Artes escénicas
517,ANIMALES AUTÓCTONOS 3,animalesoutoctonos,Argentina,Es la primera Serie de Biodiversidad y Ecorregiones para niños de la Argentina donde encontrarás la belleza de nuestros paisaje y su fauna.,57625,103,8600,127,Editorial
518,CAROLINA,Diana Rivera Martinic,Chile,"Montaje de una comedia chilena, de la destacada dramaturga nacional Isidora Aguirre. ESTRENO 16 DE JUNIO DEL 2016 - SALA LA VITRINA",47449,103,12600,61,Artes escénicas
519,"PELÍCULA ""LA LÍNEA AMARILLA""",Gonzalo Barceló,Chile,Para la realización de nuestro primer largometraje de ficción.,93381,103,13800,63,Cine y video
520,UN VIDEO PARA YEIMS BONDI,YEIMS BONDI,Argentina,"Ayudanos con nuestro primer videoclip: ""Argentinos sin domesticar"" (Somos de acá) Formá parte o contribuí como te guste ¡GRACIAS! :)",4056,103,10100,33,Cine y video
521,RODRIGO ROJAS DE NEGRI,veronicadenegri,Chile,Exposición de los archivos fotográficos inéditos de Rodrigo Rojas de Negri para ser exhibido en Santiago,70944,103,27900,118,Artes visuales
522,PERDÓN Y GRACIAS CORTOMETRAJE,Sami Marx,Chile,"Pelìcula maulina que hace una nueva propuesta sobre la libertad y la errancia, donde la alegría y la belleza parece imponerse a la amargura.",7379,103,2300,10,Cine y video
523,METAMORFOSIS,Marco,Argentina,"METAMORFOSIS es un documental que cuenta la historia de Pablo Gasparini, un corredor de Trail Running de la Ciudad de Córdoba.",10098,103,2400,20,Cine y video
524,"EDITA, UNA CHECA CHILENA",Pamela Pollak,Chile,Proyecto de documental en etapa de edición que desea postular a los mercados de Work in Progress para lo que necesita 40 minutos de montaje.,178039,103,13500,101,Cine y video
525,"HORACIO QUIROGA, CUENTISTA",Taller El Mate,Argentina,"Largometraje basado en la vida y la obra de Horacio Quiroga que reúne el trabajo colaborativo de chicos y grandes en el Taller ""El Mate"".",18628,103,15700,83,Cine y video
526,EL DÉCIMO CASO,Grulla Films,Argentina,"Tesis de Imagen y Sonido UBA. Un médico intenta encontrar la cura de una enfermedad, ignorando lo que en realidad necesita el paciente.",3732,103,10800,657,Cine y video
527,ETERNA VENGANZA,Oscar Rodríguez Górriz,México,"Eterna Venganza es un cortometraje sobre una joven mujer que busca castigar a todo hombre que humilla, maltrata y abusa de otras mujeres.",33250,103,10800,14,Artes visuales
528,JESUITAS ACÚSTICO 2018,"Cristóbal Fones, SJ",Chile,Cuatro sacerdotes de diversos países registrando composiciones ignacianas para compartir en internet. Una misión de colaboración y música.,103821,103,13500,79,Música
529,"CARRONA, LA PELICULA.",Valeria Videla Mardones,Chile,"Jovenes estudiantes desean realizar cortometraje ficcion de 21 min como su tesis, utilizando como tema el incesto entre madre e hija.",44880,103,11600,26,Cine y video
530,ENTREVISTAS FEMINISMO,Nuria Becu,Argentina,Una plataforma web que promueve la reflexión sobre feminismo.,94119,103,12800,58,Cine y video
531,LA NOCHE DEL CHIHUAHUA,Guillermo Grillo,Argentina,"Largometraje de ficción que combina elementos del cine de terror, el comic y la comedia más disparatada.",74431,103,22100,69,Cine y video
532,"SOFÍA, LA SERIE",Nicolás Teté,Argentina,Sofía es una webserie que habla sobre diferentes crisis que se producen a lo largo de la vida y el miedo al cambio. Sofía es como vos.,28870,103,22400,27,Cine y video
533,NELSON CAVAQUINHO POR SURURU NA RODA,Sururu na Roda,Brasil,Homenagearemos um dos maiores compositores da música brasileira no centenário do seu nascimento: Nelson Cavaquinho.,142207,103,2400,179,Música
534,RODRIGO SANTOS AO VIVO EM IPANEMA,rodrigo santos2,Brasil,"DVD Rodrigo Santos ao Vivo em Ipanema, com Frejat, Leoni, Isabella Taviani, Ney Matogrosso, Léo Jaime e outros.",69152,103,2100,52,Música
535,SAMMY (SADO FRIEND),ChesterG,Argentina,"La idea es producir una figura coleccionable para adultos, fabricada en resina de 10 cm, pintada a mano y con stickers para customizar.",4069,103,11200,43,Juegos
536,"SINCITA, TUITEAR EN FUTURO",fabricio caiazza,Argentina,De internet a las calles. Un libro para las intervenciones de Sincita.,49461,103,16800,41,Artes visuales
537,SILLA ALMA,Ariel Rojo,México,"""Silla Alma"" esta hecha de aluminio 100% reciclado, material que tiene una larga vida útil debido a su alta resistencia a la corrosión.",222765,103,17900,20,Diseño
538,ESPEJO CHINO - NUEVO ÁLBUM,Espejochino,Argentina,Estamos en la parte final de nuestro primer disco. ¡Ayúdanos a terminarlo y te lo enviamos en formato digital junto a otras recompensas!,13464,103,1800,51,Música
539,SAMBA MISTURADO,Sergio Castanheira,Brasil,"Gravação do CD Samba Misturado, de Sergio Castanheira. Um projeto que mescla instrumentos, gêneros musicais e amigos.",29359,103,1900,82,Música
540,PROYECTO BANDA ABRAD´OS ZÓIO,Banda AbradOs Zoio,Brasil,"Zoiud@s, queremos a ajuda de vocês para prensar e fazer um Show de Lançamento do nosso 1º CD. Quem topa nos ajudar? Abraços #AdZ",20847,103,10000,83,Música
541,FESTIVAL DE JAZZ EN CARTAGENA,Algomas Enelequipaje,Argentina,Recientemente fuimos seleccionados para el Cartagena de Indias Voces Del Jazz Festival. Necesitamos apoyo para poder participar del evento.,1520,103,9900,31,Música
542,TRAPECIO,Saiko,Chile,"Para celebrar nuestros 15 años, editaremos nuestro nuevo disco en formato CD y vinilo. Queremos que seas parte de él. Escoge como participar",208127,103,30100,179,Música
543,SE PARTE DE NUESTRO PRIMER CD!,Suena Candombe,Uruguay,"Nuestro disco ya está en su etapa final, ayudanos para que podamos hacer la edición, réplica y difusión del CD...y que llegue a tus manos!",16594,103,8900,23,Música
544,PRIMER DISCO DE ITALO AGUILERA,Italo Aguilera,Chile,"Agrupación de jazz formada por Italo Aguilera, basada en composiciones originales del guitarrista.",29516,103,4100,18,Música
545,GRUPO CAYÚ,Grupo Cayú,Argentina,"Te invitamos a formar parte de nuestro primer disco ""Conjuntamente"". Sólo falta financiar esta última etapa para que el disco sea fabricado.",4379,103,6000,46,Música
546,MI PRIMER DISCO SOLISTA!,Juan Pablo Grossi,Argentina,"Habiendo empezado a grabar mi primer trabajo, necesito fondos para la masterización, replica y distribución del disco",10147,103,9300,53,Música
547,GRABACIÓN DISCO NASTY TRIO,Cristobal Moises Tobar Bachler,Chile,"Grabacion en estudio, mezcla, masterizacion y edicion fisica del primer disco de Nasty trio. Una descarga de funky sucio y sensual.",29459,103,2900,23,Música
548,#SOMOS // SOMÁTICOS,Somaticos,Argentina,"Pre venta exclusiva de #Somos, nuestro nuevo disco! Conseguilo antes que nadie, recién salido del estudio! Sumate, copate y compostate.",8431,103,3800,54,Música
549,RALLY FOR GRACE'S NEOSOUL,Grace Portillo,Argentina,"Con tu apoyo logro lanzar mi debut album ""Sticky Nostalgia"" y mi primer videoclip. Gracias por apoyarme en esta locura!",11879,103,3300,55,Música
550,SANTIAGO TORRICELLI ENSAMBLE,santiago torricelli,Argentina,Santiago Torricelli ensamble grabó su primer disco! Sólo nos falta financiar las etapas de mastering y fabricación de los CDs. Sumate!,10098,103,2500,34,Música
551,A LO LEJOS SONABAN DISPAROS,La Joven Guarrior,Argentina,Somos una orquesta de musica popular a punto de editar su cuarto álbum. Ayudanos con esta campaña para fabricar el disco en formato físico.,10098,103,3700,60,Música
552,¡ÚLTIMOS 2 DÍAS LIBRO TERAPIA NARRATIVA LATINOAMERICANO!,Pranas Chile,Chile,¡¡¡Contribuye con 30 dólares y llévate un edición especial del libro firmada por l@s editor@s!!! Edición del libro PRÁCTICAS LATINOAMERICAN,114528,103,13000,65,Música
553,1ER DISCO DE WE ARE THE GRAND,We Are The Grand,Chile,Se parte de la grabación de nuestro primer disco.,124180,103,15700,45,Música
554,CUATRO GATOS NEGROS FLACOS,Laura Varsky,Argentina,"Somos tres personas amantes de los libros y, por qué no, de los gatos también. A Didi Grau le gusta jugar con las palabras, a Christian Montenegro con las ilustraciones y a Laura Varsky con el diseño y las tipografías. Juntos desarrollamos este nuevo libro álbum, porque nos apasiona lo que hacemos y nos encantaría que los demás puedan disfrutar de él tanto como nosotros disfrutamos al crearlo. ""'Cuatro gatos negros flacos' es un libro juego de 4 palabras que se repiten multiplicándose en espejo. Palabras que crecen y decrecen. Palabras horizontales, verticales, diagonales, palabras en zig-zag. Un libro juego de dibujos que cuentan sus historias multiplicándose para después decrecer y volver al principio pero al revés: 4 gatos que sonríen, que se burlan, que guiñan, que duermen, que se desperezan."" Por su producción gráfica “Cuatro gatos..” es un libro que, por la vía clásica de realización (a través de editoriales, distribuidores y librerías), llegaría con un precio muy alto a sus compradores. Es por esto que pretendemos poder hacer un camino directo entre lectores y autores, es decir entre ustedes y nosotros. El plan es hacer una edición exclusiva de 500 ejemplares impresos en offset, firmados y numerados por sus tres autores. Trabajamos con los mejores proveedores a la hora de hacer libros, buena calidad de papel, tintas y encuadernación. “Cuatro gatos..” es desplegable y mide 20 cm x 20 cm cuando está cerrado. Pero cuando se despliega ¡alcanza una longitud de 4 metros! --- Un libro sin edades, para chicos y para grandes. Para mirar solos o acompañados. Para disfrutar sobre la mesa página por página o desplegar sobre la alfombra y tenderse a leer los dibujos y a ver las palabras. Para jugar a encontrar detalles, para buscar diferencias y coincidencias. Para ver de principio a fin y de fin a principio. Para mirar a dos puntas y encontrarse en el medio. Para observar de cerca, muy cerca, o de lejos, lejísimo. En fin, un libro objeto que, como una caja mágica, esconde historias, todas las que cada uno quiera inventar. Esperamos contar con tu ayuda para hacerlo realidad!",232177,102,56400,126,Editorial
555,EL DESAFÍO DE NITUKE - LIBRO,Condimento la Vida,Argentina,"Es un Cuento que INCENTIVA a COCINAR, COMER LAS VERDURAS Y CEREALES INTEGRALES ¡LOS CHICOS SÍ COMEN LAS VERDURAS !",7819,102,19200,193,Editorial
556,MATEO DE LA LUNA ECT,mateodelaluna,Argentina,Conjunto Musical MATEO DE LA LUNA EN COMPAÑÍA TERRESTRIAL PRESENTA: LA ENERGÍA DE LOS PLANETAS,7595,102,18000,89,Editorial
557,CORSELET ? GRAVAÇÃO DO CLIPE E SHOW DE LANÇAMENTO,Maíra Freitas,Brasil,Colabore com a gravação do primeiro clipe de Maíra Freitas e com um show de lançamento do vídeo!,37286,102,3000,85,Música
558,¡QUE VUELVA VIEJAS CHOTAS!,9 Reinas,Argentina,"Somos 9 Reinas, una nueva productora que quiere montar y estrenar VIEJAS CHOTAS, un musical tragicómico que desnuda el universo femenino.",6680,102,12400,63,Artes escénicas
559,TRÍPTICO [IR]RELATO A 3 VOCES,Cronopolis Teatro,Chile,"""TRÍPTICO [Ir]relato a tres voces"" conjuga 3 cortos teatrales inspirados en Simone de Beauvoir, Gabriela Mistral y Virginia Woolf. Ayúdanos!",7322,102,8600,16,Artes escénicas
560,FEDE LUCERO · CIELO DE HUINCA,fedelucero,Argentina,"Sumate y colaborá con la edición física de ""Cielo de Huinca"", mi primer disco de canciones.",16699,102,2700,40,Música
561,BANDALOS CHINOS. SALE EL DISCO,Bandalos Chinos,Argentina,"Hola, somos BANDALOS CHINOS y estamos terminando nuestro PRIMER disco. Si, te vamos a manguear, necesitamos TU ayuda. FB: /bandalos.chinos",74023,102,14600,83,Música
562,"LITTLE DOROTHY, EL 1ER DISCO",Little Dorothy,Argentina,Ya tenemos nuestro primer disco grabado! Solo nos falta fabricarlo y para eso necesitamos tu ayuda.,110398,102,12500,143,Música
563,SEGUNDO DISCO DE LEÓN VIEJO!!,Leon Viejo,Uruguay,"Queremos hacer realidad nuestro segundo disco! Grabarlo, mezclarlo, masterizarlo y producirlo, y queremos que vos seas parte!!!",159306,102,12200,32,Música
564,"13° FESTA DO DIVINO EM SP, NO ESPAÇO CACHUERA!",Bartira Helena Reis de Menezes,Brasil,Contribua para a realização da 13° Festa do Divino Espírito Santo em SP! Participe desta grande festa popular de tradição maranhense aberta,62217,102,4700,89,Música
565,CURSO DE MACROFOTOGRAFÍA,pdolsan,Argentina,"Completo curso con los equipos, técnicas y consejos para lograr las mejores fotografías macro de naturaleza.",16762,102,6200,31,Editorial
566,VANESSA MORENO E FILIPE MARÓSTICA,Vanessa Moreno e Filipe Maróstica,Brasil,Gravação do primeiro CD do duo de baixo e voz de Vanessa Moreno e Filipe Maróstica,55969,102,7600,100,Música
567,ENSAMBLE TRANSATLÁNTICO - DVD,Ernesto Calderon,Chile,"Esta original agrupación te invita a colaborar con su DVD, y así ser parte de esta gran revolución musical, pacífica e inclusiva",44102,102,10700,68,Música
568,"""LÚNICA"", MI NUEVO DISCO",Analía Garcetti Grupo,Argentina,Hola! Busco que mi tercer producción discográfica salga a la luz. Me ayudás?,16739,102,5100,49,Música
569,"""LA CUMBIAMBA SE DESATA""-1° CD",La Abuela Cumbiambera,Argentina,"Somos una orquesta de cumbia, que interpreta composiciones propias. Ya grabamos el CD, ahora necesitamos ayuda para poder imprimirlo!",2353,102,5300,35,Música
570,"LA CHANCHA MUDA, NUEVO DISCO!",El Gusano Podrido,Argentina,"La Chancha Muda necesita parir por segunda vez, sea como sea! Un disco explosivo, rebelde y combativo. Ayudanos a escupir todo esto!",16798,102,9300,35,Música
571,CD CONECTADOS POR EL INFINITO,Conectados por el Infinito la banda,Uruguay,"Somos Conectados por el infinito, la banda. Queremos pedirte tu colaboración para materializar el sueño de grabar nuestro primer disco.",43778,102,11700,120,Música
572,¡DISCO PARA HELADO INFINITO!,Helado Infinito,Argentina,¡Luego de un año de viaje y de grabaciones itinerantes ya tenemos listo nuestro primer disco! ¡Hoy queremos editarlo en físico! ¿Nos ayudas?,11765,102,7800,56,Música
573,"""DESPUÉS DE VIVIR UN SIGLO""",paulaferre,Argentina,El proyecto es la realización de un Disco Homenaje a Violeta Parra por artistas importantes del Folklore Nacional e Invitados especiales.,16729,102,10900,89,Música
574,DESENCUENTRO [LA OBRA],Paula Muzzio,Argentina,Montaje y estreno de una obra de teatro-tango que desnuda la intimidad de una mujer que espera el encuentro con su gran amor.,3327,102,5800,25,Artes escénicas
575,CUENTO ILUSTRADO DE AGUS&FLOR,Agustina Pessio,Argentina,"“La casa del árbol y el caballito de madera” Un cuento ilustrado que narra la historia de Olivia, una niña con una imaginación sin límites.",8343,102,6900,69,Editorial
576,DOCUMENTOS TERRITORIALES,Documentos territoriales,Argentina,Libro de dibujos que hicimos en un viaje por Centroamérica.,8382,102,5800,45,Editorial
577,MONTE MADRE,Alan Robinson,Argentina,"Una obra de teatro basada en una historia real, sobre una pareja que sobrevivió 4 años en el monte chaqueño, escapando de los militares.",24610,102,12300,24,Artes visuales
578,CASAS DE ARTISTAS URUGUAY,Casas de Artistas,Argentina,Necesitamos poder entrar a imprenta. El libro muestra la intimidad de los talleres y artistas plásticos uruguayos con fotos y entrevistas.,30870,102,8100,25,Editorial
579,PUTAS - HERSILIA ALVAREZ,Hersilia Alvarez,Argentina,¡AHORA queremos publicar PUTAS en formato libro!,28154,102,26200,106,Editorial
580,REVISTA REA 2: POLÍTICA+CIUDAD,RED ESTUDIANTES ARQUITECTURA,Chile,Publicación de la Red Estudiantes Arquitectura. busca ser un espacio de difusión aproximándose a la arquitectura desde una mirada crítica.,7293,102,1500,13,Editorial
581,"CÓMIC ""PERROTE""",Victor Silva,Chile,Primer capítulo de las aventuras de Perrote junto a Conejo y Gatito.,2932,102,3700,13,Editorial
582,TRABAJO PARA LOBOS,Maruja Bustamante,Argentina,Necesitamos apoyo para hacer la escenografía de la obra. Esto es teatro independiente en Argentina. El arte de los entusiastas. Ayudanos!,24610,102,16800,35,Artes visuales
583,EXPOSIÇÃO SINESTESIA,Leonardo Miranda,Brasil,"Exposição multisensorial e multimídia que mistura poesia, música, artes plásticas e fotografia no Rio de Janeiro.",29117,102,4400,17,Artes visuales
585,LA CIMA DEL MUNDO,Mutantecine,Argentina,"Cortometraje Documental/Ficción que narra la historia de Tito, un niño que hace malabares en semáforos para vivir.",5002,102,6500,16,Artes visuales
586,A 1232 CABEZAS,Vicky Apolinario,Argentina,Cortometraje sobre mujeres migrantes dominicanas en Argentina. De Constitución a Dominicana - La delirante carrera por un doloroso retorno.,3333,102,7800,12,Artes visuales
587,GOLEM,Golem,Argentina,Un corto en stop motion que explora las dimensiones de la creación. A través del Mito y el Rito antiguos misterios son develados.,10092,102,17300,345,Artes visuales
588,DESAFÍO ZENTANGLE,victoriamor,Argentina,Zentangle es dibujar libre y creativamente. Quiero asistir al seminario para certificarme como profesora y seguir aprendiendo!,26167,102,25300,136,Artes visuales
589,CAMALEONICX CCI KIU,Cci,Argentina,"Este es el segundo disco de CCI KIU. Con el apoyo de todxs ustedes,se puede hacer físico este sueño de seguir haciendo lo que más nos gusta!",16749,102,1500,31,Música
590,TRASCENDER,Jorge Caamaño,Argentina,Disco de tango y folklore. Homenaje a los maestros de la guitarra Argentina.,8709,102,2700,60,Música
591,FRANCA STOPMOTION,Laura Paulina,Argentina,"Es un cortometraje en animación stopmotion, cuenta la historia de Marina, una niña de 7 años y su amiga la ballena franca austral",23366,102,2400,40,Cine y video
592,TORNADO,Nacho Ceroi,Argentina,Alejandra predice un tornado y viaja repentinamente. Octavio se queda a cargo del asunto. Nos hablan testigos del tornado en Chivilcoy.,1667,102,3800,13,Cine y video
593,"IMPROPIAS, LA PELÍCULA",Florencia Nizzo,Argentina,"¿Y si te dieran la llave de un departamento para entrar y, en 10 minutos, llevarte lo que quieras? ¿Tomarías el riesgo?",4033,102,5800,130,Cine y video
594,TRAYECTORIA (LARGOMETRAJE),Spaghetti Film,Argentina,Largometraje de Matias Erazo y Fernando Alegre. El guion se construirá desde la improvisación con el vértigo de un rodaje de 5 días.,5000,102,3200,17,Cine y video
595,PSICÓTICAS INSEGURAS II,Psicóticas Inseguras,Chile,"Queremos hacer la segunda temporada de nuestra queridísima y única webserie. Ayúdanos, porfis.",146007,102,43800,345,Cine y video
596,DOCUMENTAL IRONMAN FERNANDA,Claudio Alfaro H.,Chile,Fondos para viajar junto a Fernanda a grabar la culminación de este documental de un largo proceso de sanación en el IRONMAN de Brasil,48364,102,7000,60,Cine y video
597,EL SUEÑO Y EL CONEJO,elsuenoyelconejo,Argentina,Nix tiene problemas para dormir de noche. Hasta que un día recibe un mail de “La Fábrica de Sueños” y su vida cambia completamente.,4363,102,6400,15,Cine y video
598,IKIGAI - LA PELÍCULA,Iván Preuss,Argentina,Esta película 100% independiente necesita TÚ ayuda para poder realizarse. ¡Formá parte y juntos incentivemos el cine Patagónico!,16683,102,4300,27,Cine y video
599,INFECCIÓN,Sele Algañarás,Argentina,"Cortometraje de ficción - Cuando Tamara es mordida por un infectado, Julia decide arriesgarlo todo para salvarla, aunque la otra no quiera.",6961,102,971,28,Cine y video
600,PIECECITOS,PIECECITOSDVD,Chile,"Capítulo final de serie animada “Piececitos”, poemas de Gabriela Mistral. Refleja la esperanza e imaginación de los niños de la calle",122955,102,10200,35,Cine y video
601,"PEDRO, EL CORTOMETRAJE",Pedro el cortometraje,México,"""Pedro"" es un cortometraje de ficción sobre la historia de un niño de 8 años que vive una experiencia que lo transformará para siempre.",319357,102,12900,101,Cine y video
602,MOCHA.,Bachillerato Popular Mocha Celis,Argentina,"Nuestra Lucha, Su Vida, Mi Derecho.",26781,102,19900,121,Cine y video
603,"NOCHE, LA PELÍCULA",Noche,Chile,"Sé parte de Noche, el nuevo largometraje chileno dirigido por Inti Carrizo-Ortiz. Construye con nosotros el final de esta historia.",79310,102,22800,148,Cine y video
604,SUBE: SOL Y LUNA (2DO EP),Raúl Moya,Chile,Han pasado 2 años desde que ETEREOPUERTO vió la luz. Hoy tenemos nuevos temas que queremos registrar y difundir.,44045,102,2500,44,Música
605,"""RUMBOS"" NUEVO ÁLBUM!",Demián Ismael,Argentina,RUMBOS es mi segundo trabajo de estudio y estoy muy entusiasmado de poder compartirlo con vos. ¿Me ayudás?,22729,102,4400,63,Música
606,"""NÁUFRAGO"" EN LAS MANOS",TodoEs Verso,Argentina,"Ya está, ""Náufrago"" es una realidad, pero una realidad digital por ahora. Ayudanos a hacerlo una realidad real (de esa que se puede tocar).",5016,102,4900,48,Música
607,TENEMOS UN PROBLEMA!!!,Vocal Miscelánea,Argentina,"Queremos ir a concursar al XI Festival Coral Internacional Gustavo Gomez Ardila en Colombia, y necesitamos tu ayuda.",20115,102,4500,67,Música
608,DISCO DUENDES DE JARDÍN,Leonardo Fontecilla,Chile,Nuevo disco de canciones para la infancia compuesto por Leo Fontecilla (Don Barbarroja),102963,102,7200,57,Música
