,Proyecto,Autor(a),País,Descripción,Recaudación,Porcentaje,Vistas,Colaboradores,Categoría
1216,AGUA DEL ESTE - CORTOMETRAJE,Fortuna Films,Chile,Cortometraje que habla sobre el poder de la naturaleza frente al hombre y la superación de una pérdida a través de guiños fantásticos.,22366,39,2800,28,Cine y video
1217,¡EL AFTER DEL MUNDO!,El after del mundo,Argentina,Un cortometraje 2D de animación tradicional digital en desarrollo // Una aventura existencialista sobre nosotres sin nosotres,7827,39,1600,30,Cine y video
1218,EL MISTERIO Y LA FE - NUEVO CD,NARANJOS,Argentina,"Ayudanos a replicar nuestro nuevo disco ""El misterio y la fe"" y llevate tu copia a precio promocional. Hay muchas recompensas",7173,39,2200,44,Música
1219,KATMANDÚ A PURO DISEÑO!!!,Katmandu Ceramica,Argentina,Vamos a la feria! Y queremos que nuestro stand y producción sea hermosa y suculenta!,4479,39,17900,71,Diseño
1220,REVISTA PAPEL BARRILETE,papelbarrilete,Argentina,"Queremos lanzar Papel Barrilete, una revista sobre las infancias y sus culturas ¿Nos ayudás a hacer realidad este primer número?",4533,39,11500,65,Editorial
1221,MADRE MÍA,Benjamín Delgado,Chile,Madre Mía es un Cortometraje de Género Drama.Nuestra Historia Trata de Gabriel (33) que cuida a su Madre Ana (65) enferma de Demencia Senil.,5577,39,2500,5,Cine y video
1222,IN CRESCENDO ¡NUEVO DVD!,Andres Novío,Argentina,Apoyá esta producción artística de música de cámara independiente adquiriendo el nuevo DVD!,4412,38,5100,24,Música
1223,MANUMARÍA,Manu Maria,Argentina,Plasmar el camino andado. Grabar las canciones que me han hecho crecer y poder entregarlas a las personas que apoyaron este proyecto.,3105,38,1500,12,Música
1224,MISTER P. A LA RURAL!,Mariana De Marchi,Argentina,"Expondré a Míster P. -el gran señor metálico- en BADA, en La Rural. Busco colaboradores que ayuden a solventar los costos del proyecto.",4608,38,5700,25,Artes visuales
1225,GRABACIÓN DE MI PRIMER EP,Ricardo Ruz,Chile,Llegó la hora de darlo todo en el estudio y compartirles cinco canciones hechas con amor. Y queremos que seas parte de esta entrega!,9238,38,4000,18,Música
1226,LA TITULAR I SERIE WEB,perroqueladra,Argentina,¡Ponete la camiseta! La Titular es un proyecto de serie web que puede ser posible gracias a vos.,39772,38,18800,95,Cine y video
1227,SIESTAS,Siestas,Argentina,Trasposición cinematográfica del cuento de Julio Cortázar. En un vaivén entre los sueños y la realidad transitará la historia de W & T.,3121,38,6700,13,Cine y video
1228,LA LLUVIA ES TAMBIÉN NO VERTE,May Bottero,Argentina,"Documental de creación acerca de “La tragedia de Cromañón”, retrato de estos diez años de historia y búsqueda de justicia.",3735,38,13300,68,Cine y video
1229,"NUEVO DISCO: ""SEGUNDO""",Ainda Dúo,Argentina,¡¡Hola!! Terminamos de grabar. Ahora nos falta masterizar y hacer las copias para que el disco llegue a tus manos y tus oídos.,9925,38,10300,145,Música
1230,DECONSTRUCCIÓN,Noseso Records,Argentina,Preventa del tercer disco del Ensamble Chancho a Cuerda.,1255,38,5900,14,Música
1231,UN MUNDO DE PAPEL,Luz Miglionico,Chile,Inspirada en la hermosa complejidad del origami. Aprende y forma parte de un mundo de encanto y creatividad!!!,5506,38,7000,9,Diseño
1232,LA TERAPIA DEL CAOS,Ignacio Santonja,Argentina,Un psicólogo de métodos cuestionables teje una red de manipulaciones para llevar a sus pacientes hacia un desenlace fatídico.,2435,37,817,8,Cine y video
1233,PASO A PASO (MUSICAL P/CRECER),SebasVitale,Argentina,"Ayudanos a cumplir el sueño de contar esta historia llena de emoción, música y alegría. Con esto obtendrás entradas, el disco y felicidad!:)",8660,37,2500,30,Artes escénicas
1234,LARGOMETRAJE UN FUEGO LEJANO,TOS SECA,Chile,"Opera prima rancagüina: escenarios reales, no actores, luz natural y un poco de improvisación. Un misterio que mezcla ficción con documental",15873,37,1600,11,Cine y video
1235,LA NIÑA QUE ILUMINÓ LA NOCHE,Casandra Rey,Argentina,Cortometraje de fantasía realizado por alumnos de la Universidad del Cine.,1095,37,1800,11,Cine y video
1236,JO É PU - CORTOMETRAJE,Roberto Barbery,Argentina,"Por un lado es aluminio, humo y orgasmos. Por otro, son diez cuchillas clavando un pulmón. Esto es un acordeón descompuesto. Esto es Jo é Pu",8065,37,7700,153,Cine y video
1237,LA PLUMA BUSCA IMAGEN,Ricardo Andrés Saldarriaga Escobar,Colombia,"Desde abril del 2011 inicia mi blog, una propuesta independiente de literatura experimental. Hoy quiero financiar el diseño web del mismo.",900,37,7200,7,Editorial
1238,RECONSTRUCCIÓN TEATRO ODEÓN,Pequeño teatro de Morondanga,Uruguay,El 1 de enero 1996 se incendió el teatro Odeón en Montevideo (UY). A principio de 2018 decidimos que era hora de volver a abrir sus puertas.,36175,37,11500,52,Artes escénicas
1239,DE DÍA LA NOCHE,Leonardo Funes,Argentina,CORTOMETRAJE. Es verano. Una casa vacía. Los preparativos para una fiesta y tres amigos que se ponen en juego.,3667,37,9100,577,Cine y video
1240,AVUELA - SERIE WEB,Infinidad Audiovisual,Argentina,Serie web de concientización sobre el efecto de las drogas a través de la comedia. Una abuela (Julia Calvo) cae en las drogas. Ayudémosla!,6134,37,12200,232,Cine y video
1241,MI GESTO PANK,Micaela Szyniak,Argentina,Revista de poesía feminista.,4869,37,5700,39,Editorial
1242,"""AVECHUCHOS"" POR NICOLÁS BLUM",Ariadna,Argentina,"""Avechuchos"" será una edición especial de En Otro Orden de Cosas, donde habrá collages, poesías y letras de canciones de Nicolás Blum.",2222,37,920,9,Editorial
1243,SOLSTICIO DE VERANO,Paula Mora,Chile,"Cortometraje estudiantil, ambientado en época de dictadura, la historia trata sobre un amor imposible entre dos mujeres.",6492,37,2100,21,Cine y video
1244,"""EL CAMPO"" OBRA TEATRAL.",Porelpuente,Argentina,"""El Campo"", Un texto de 1967 de Griselda Gambaro, en una nueva puesta, donde nos replanteamos quienes somos como sociedad.",3660,37,2300,16,Artes escénicas
1245,PATERA QUIERE SELVAS,Patera,Argentina,"Nuestro 1er disco. Tenemos las canciones, nos sobran las ganas, ayudanos a dar los últimos pasos para que nuestra música llegue a tu casa!",2735,37,5100,153,Música
1246,"""SOY UNA TARADA"", DISCO DOBLE.",Lucho Guedes,Argentina,"Canciones que podrían ser cuentos, poesía que podría ser prosa, drama que podría ser comedia, grandes cantantes y una orquesta.",7382,37,9400,92,Música
1247,EL PRIMER CD DE FEMMEVOCAL,FemmeVocal,Chile,Queremos crear un registro que dé cuenta del resultado de años de trabajo. Ayúdanos a lograrlo!!!,32405,37,4300,50,Música
1248,¡AYUDÁ A TREN ELEFANTE!,Tren Elefante,Argentina,Estamos en la última etapa de la grabación de nuestro primer disco. Llevate altas recompensas a cambio de tu colaboración. Don´t be careta.,3709,37,1600,24,Música
1249,"DANTE, EL GUERRERO TOTEM",Claudio Volta,Argentina,Queremos sumar a Dante a la familia de Guerreros de Oficina Volta Good Wood.,2435,37,4300,15,Diseño
1250,PARATEATRO,PARATEATRO,Argentina,Que tu escenario no esté vacio - Reciclando escenografía y utilería,3039,37,3900,16,Artes escénicas
1251,AZUL CORTOMETRAJE,Autsaiders Prod,Argentina,"Cortometraje que busca explorar el mundo interno de una chica de 13 años, en un momento donde todo está cambiando.",4853,37,1600,13,Cine y video
1252,"""ANIMALES"" NOVELA GRÁFICA",Marcos Vergara,Argentina,"¡Ayudá a Rodolfo Santullo y a Marcos Vergara a publicar su novela gráfica ""Animales"", comedia costumbrista con misterios y emociones!",5899,36,7000,38,Editorial
1253,CIUDAD CELULAR,Mercurio Sosa,Argentina,"Ciudad Celular es un libro de ciencia ficción, que va a ser editado por Malisia Editorial, bienvenidos a la Ciberdelia",2360,36,5300,31,Editorial
1254,LA REVISTA DEL BARRIO,Lucas Palacios,Argentina,"Ayudanos a imprimir nuestra revista y a contar cómo es nuestro barrio, cómo somos nosotros y cómo nos vemos a nosotros mismos.",588,36,2700,10,Editorial
1255,COPLAS PICANTES...CLAUDIO SOSA,Claudio Sosa,Argentina,"Ayuda con tu aporte a la Edición Independiente del CD COPLAS PICANTES, disco de cantautor de CLAUDIO SOSA, grabado durante el 2014.",4706,36,7600,38,Música
1256,POR EL DISCO DE DE LA ORILLA!,De la Orilla,Argentina,"Ayudanos a grabar nuestro primer disco, en el que hemos puesto 2 años de trabajo. Formá parte de él! Te lo agradeceremos eternamente!",3016,36,3600,30,Música
1257,TIMELIFE,TIMELIFE,Argentina,"Una serie web muestra como la vida de las personas puede ser alterada en un instante, aunque esta ventaja puede ser un arma de doble filo.",4134,36,2300,21,Cine y video
1258,FRAGMENTOS AZULES,Flor Brocchi,Argentina,Es un proyecto de largometraje de ficción que apuesta al cine independiente. Ayudanos!,1440,36,9000,27,Cine y video
1259,EQUIPO ROBADO ¡RECUPERÉMOSLO!,bonominilali,Argentina,"A mi amigo Axel, videógrafo, le robaron prácticamente todas sus herramientas de trabajo. Convirtamos esta anécdota fea, ¡en una increíble!",8304,36,15500,210,Cine y video
1260,NOE TERCEROS - ¡PRIMER DISCO!,NoeTerceros,Argentina,"Soy Noe Terceros, intérprete y compositora de rock/pop. Mi primer disco solista necesita de tu complicidad para que pueda salir a sonar.",5905,36,3500,54,Música
1261,"TIN: EXPO EN BADA, LA RURAL",Tin Art,Argentina,Estoy buscando fondos para participar en la Expo BADA (en Sept en la Rural). Oportunidad única para mostrar mis obras a gran público.,2941,36,5100,11,Artes visuales
1262,EP ITINERANTE SONORA,Itinerante Sonora,Chile,"Co-Financiar entre la banda y ustedes la producción, grabación, mezcla, masterización y post-producción del primer EP de la Banda.",6206,36,8100,12,Música
1263,VIDEOCLIP TROPICAL STORM,lemonlab,Chile,"El primer single de la Drag chilena, Neptune, busca financistas para la realización del videoclip de Tropical Storm.",5234,36,2100,17,Música
1264,"SIGNOS, SHOW EN VIVO!",Pablo Paredes,Argentina,"Te invitamos a ser Productor Ejecutivo del show del Teatro Gran Rivadavia, donde presentamos Signos, el cual editaremos en audio y video!",7190,36,2300,35,Música
1265,"OPERA ""CURLEW RIVER” B.BRITTEN",Lirica Lado B,Argentina,"Lírica Lado B presenta en mayo, el ESTRENO LATINOAMERICANO en Argentina, de una joya lírica de Benjamin Britten, en la fábrica IMPA y GRATIS",5882,36,6200,28,Artes escénicas
1266,CONCEPTOS Y ABSTRACCIONES,paula monesterolo,Argentina,Un cortometraje sobre las expresiones de las identidades en crítica a las limitaciones impuestas por los conceptos que hoy buscamos romper.,3219,36,2200,7,Cine y video
1267,"CORTOMETRAJE ""DOMINGO""",bcastanedar,Argentina,""" DOMINGO"" es un cortometraje de búsqueda, de pretextos, de razones, de un calcetín.",2369,36,2900,12,Cine y video
1268,¡A LAS MÁSCARAS!,Alto Ministerio,Argentina,"¿Quiere el primer disco de ""El Hombre Misterioso y sus Misterios""? ¡Pues ya puede asegurarse el suyo!",4657,35,4000,54,Música
1269,COMPRÁ EL DISCO ANTICIPADO!!!,juan ramirez,Argentina,"Llegar al oído y el corazón de los conocidos amigos y los desconocidos, con los cuales nos estaremos uniendo a través de estas musiquitas!!!",1373,35,2400,28,Música
1270,BANDA CARITO PLAZA A JAPÓN,Carito Antonia Plaza Hamamé,Chile,Necesitamos tu ayuda para poder costear los gatos de viaje de los músicos de la banda Carito Plaza en su primera presentación en Osaka Japón,20192,35,9300,36,Música
1271,CIUDAD LABERINTO,Ana Pepe,Argentina,Un espectáculo de creación colectiva que habla con humor sobre la muerte y los enredos de la vida en una gran ciudad.,2673,35,2600,30,Artes escénicas
1272,SHOW PRO FONDOS BURLESQUE,Marcavas,Chile,"Somos la compañía de Teatro-Burlesque ""Provocar-T"" y actualmente estamos montando nuestro primer espectáculo ""Tacones Cardinales"".",10182,35,8700,17,Artes escénicas
1273,FESTIVAL DANZAFUERA,Danzafuera,Argentina,"Quinta edición del festival internacional de danza contemporánea, performance y acciones transdisciplinarias de la ciudad de La Plata",5721,35,4900,44,Artes escénicas
1274,LETRA+LETRA - 2 JUEGOS EN 1,Dario Levin,Argentina,"Letra+Letra es un juego de naipes para chicos a partir de 6 años. Se puede jugar dos juegos distintos: ""La quiero"" y ""Formando Dibujos"".",5850,35,6300,31,Juegos
1275,LANZAMIENTO APP,Recitales en Argentina,Argentina,Vamos a hacer nuestra app de Android y iOS. Queremos facilitar aún más la experiencia del usuario!,2333,35,21200,32,Música
1276,CAMINO Y CANTO - DISCO,inti duo,Argentina,Camino y Canto es el nombre de nuestro segundo Disco que estamos terminando de grabar. Te invitamos a ser parte de este proyecto!,2866,35,2900,50,Música
1277,AMAZÓNICA :: VAJILLA + ARTE,Amazónica,Argentina,Queremos sumar más artistas y más colecciones a nuestra vajilla ilustrada!!,4575,35,13100,91,Diseño
1278,HILO GALERÍA DE ARTE JOVEN,HILO,Argentina,"Refaccionar, Remodelar y Lanzar HILO, una Galeria de Arte Joven en Buenos Aires. Ubicada en un PH a recuperar en el barrio de Palermo.",9307,35,6600,51,Artes visuales
1279,ES UN PLACER. EL LIBRO,Hproyecto,Argentina,"Proyecto Editorial. Registro fotográfico de historias, fantasías y realidades. Narrativa de cuerpos masculinos en relación a la naturaleza.",17288,35,3100,34,Editorial
1280,DIARIO DE AMOR Y MILITANCIA,Susy Gómez,Argentina,"Relata la historia de vida de Miguel Ángel Castiglioni, desaparecido en la última dictadura militar en Argentina, y lo vivido por su familia",8039,35,2000,48,Editorial
1281,ROMPER CADENAS,Damian Grimberg,Argentina,Un libro que se sumerge en la profundidad del camino para transmitir las enseñanzas que fueron nutriendo la búsqueda del andar,1879,35,3200,16,Editorial
1282,EL PASO,Nicolas Stupenengo,Argentina,"Una película filmada en una estación de servicios, en tiempo real, 15 actores viven la experiencia de hacer una película en una sola toma.",31879,35,23200,325,Cine y video
1283,SAGRADA FAMILIA,Random Audiovisuales,Argentina,"Tras la muerte de sus padres y el reencuentro con sus hermanas, Ademia reconstruye terribles episodios de abusos sufridos durante su niñez.",4696,35,8500,285,Cine y video
1284,PASIONAL - CORTOMETRAJE,Miguel Grinbank,Argentina,"Pasional busca escuchar en silencio el tiempo de las pasiones. Como verán en el vídeo,también es una forma de duelo para quien les escribe.",5163,35,4600,17,Cine y video
1285,"AYER, HOY Y MAÑANA","Ayer, hoy y mañana",Argentina,"Obsesionada Marina por comprar un par de zapatillas que vio en Internet, ignora la crisis económica y la preocupación de sus padres.",4444,35,4400,33,Cine y video
1286,EL DESENTIERRO (LARGOMETRAJE),Claudio Perrin,Argentina,Es una road movie sudamericana en medio de una festividad típica de pueblos originarios.,17206,35,6400,70,Cine y video
1287,EL FUMIGADOR,EL fumigador,Argentina,Largometraje realizado por estudiantes de Diseño de Imagen y Sonido de la Universidad de Buenos Aires.,2783,34,11200,216,Cine y video
1288,"60 FOTOS DE ""EL 60""",COLECTIVO FOTOGRÁFICO EL 60,Argentina,"Llevar a cabo la primera muestra del Colectivo Fotográfico ""El 60"" en el Centro Cultural Borges.",5065,34,4000,20,Artes visuales
1289,CORTO SIN CULPAR A NADIE,Juan Buzzelli,Argentina,"Beto, llega a la fiesta con un arma decidido a matar a su jefe, pero las cosas no se darán como el espera.",1127,34,5100,8,Cine y video
1290,NOTAS DE LA CALLE,Ramiro Lago,Chile,Notas de la Calle es un proyecto de serie web sobre músicos callejeros alrededor del mundo. Queremos filmar el piloto para la 1er temporada.,39784,34,5600,31,Música
1291,MUESTRA DE CINE DE COMEDIA,mexfaliero,Argentina,"Segunda edición de la Muestra Internacional - Funcinema, que se realizará del 24 al 27 de septiembre en el Museo MAR de Mar del Plata.",556,34,2500,9,Cine y video
1292,PREDICADORES,leisonis,Argentina,"Cortometraje sobre la cacería de tres ladrones varios años después de un robo, a realizarse por estudiantes de cine de Buenos Aires.",2810,34,4000,16,Cine y video
1293,SEGÚN AMELIA,mlm,Argentina,"¿Hasta donde te puede llevar el miedo a una pérdida? Cortometraje tesis de la carrera de Diseño de Imagen y Sonido, UBA.",3350,34,5300,21,Cine y video
1294,CHARCO,Cool du Monde,Argentina,"“Charco” es un film sobre la música del Río de la Plata con más de 70 músicos (Fito Páez, Santaolalla, Drexler, Fattoruso y muchísimos más)",28137,34,24300,184,Cine y video
1295,HIJOS DE NADIE,Panza Films,Argentina,"""Hijos de Nadie"" narra la historia de una de las bandas que renovó la escena músical del under de Buenos Aires: Los Adolfos Rap",9003,34,2600,27,Cine y video
1296,EL VERANO QUE TE VIMOS - FILM,Tomás Roldán,Argentina,Te necesitamos a VOS para finalizar la POSTPRODUCCIÓN de nuestra película. Ayudanos y formá parte de esta increíble historia!,8513,34,2800,25,Cine y video
1297,JUAN SEREN Y LOS PÚA ABAJO,Juan Seren y Los Púa Abajo,Argentina,"Estamos grabando nuestro nuevo disco;""Tango sin reservas"". Para finalizarlo, necesitamos de tu ayuda.",6748,34,8400,85,Música
1298,EL NIÑO AZUL DE MIGUEL REP,Editorial Azul,Argentina,"NECESITAMOS TU AYUDA PARA PUBLICARLO: ""El niño Azul en el campus da poesía"", por Miguel Rep.",6781,34,8200,45,Editorial
1299,EDICIÓN DE MI SEGUNDO DISCO,Agostina Elzegbe,Argentina,"Quisiera que el arte viva en el mundo como vive en mi vida. Este disco es mi granito de arena, un pedacito de mi ser, gran parte de mi alma.",1846,34,5300,19,Música
1300,ANGIE CASARES - DISCO DEBUT,casares.angie,Argentina,Estamos en la recta final de este feliz proyecto y necesitamos tu ayuda para poder concretarlo!,9036,34,1400,43,Música
1301,DELTA - NUEVO DISCO,Benjamín Lechuga González,Chile,"Buscamos lanzar nuestro sexto disco de estudio junto a nuestra nueva cantante Paula, contemplando Música, Video clip y Libro de tablaturas.",48821,34,6000,71,Música
1302,"DON LAYO, ÁLBUM DEBUT",Don layo,Argentina,"Don Layo, es un proyecto musical instrumental, que tiene como fin recrear el repertorio folklórico argentino con una estetica sonora única.",2224,34,9300,41,Música
1303,REVISTA YO SOY,Cecilia Martínez Ruppel,Argentina,"YO SOY, revista del taller de Periodismo de YoNoFui, organización que trabaja con mujeres privadas de libertad y ya liberadas.",4860,34,8400,44,Editorial
1304,PERDONAME POR AYER,Vísperas,Argentina,Una sala de espera de un hospital público. Dos seres solitarios que cruzan sus caminos. La primera obra de la compañía Vísperas.,2958,34,4300,26,Artes escénicas
1305,DISCO DE LEO GARZÓN GRUPO,Leo Garzón,Argentina,"Queremos contar con tu colaboración para lograr editar un Disco Compacto.""Nuestra Verdad"" canciones propias de música Argentina",8677,33,5700,54,Música
1306,PRIMER DISCO BREN COLL,Bren coll,Argentina,El proyecto independiente de la solista hoy se encuentra en pre producción de la mano de la Productora Marian Pellegrino.,4641,33,8000,38,Música
1307,QUIERO SABER XQ ME DEJASTE,quiero!,Argentina,"Si dejaste a alguien, o alguien te dejó, vas a entender qué es lo que nos mueve para hacer este corto!",1639,33,14600,25,Cine y video
1308,PÁRAMO,Páramo,Argentina,Necesitamos tu colaboración para masterizar y fabricar 1000 copias de nuestro próximo disco “La Nación de la Manzanas”.,5392,33,6100,53,Música
1309,2DO ALBUM DE SINCAPOT,Sincapot,Argentina,"Con tu ayuda vamos a financiar la mezcla, mastering, lanzamiento y presentación oficial de nuestro próximo disco. Elegí tu recompensa!",4361,33,5100,41,Música
1310,MÚSICA POR ZANON - LA PELÍCULA,Música por Zanon,Argentina,Hacemos un documental sobre el apoyo artístico a la lucha de los obreros de la Fábrica Sin Patrones en Argentina. Necesitamos tu ayuda.,16226,33,7300,67,Cine y video
1311,¡AYUDANOS A ARMAR LA ORQUESTA!,FUNDACION ISLA MACIEL,Argentina,Queremos crear la Orquesta infanto juvenil de Isla Maciel. Esta iniciativa apunta a lograr inclusión social a través de la música.,17696,33,13300,103,Música
1312,FERNANDO ROSSINI / NUEVO DISCO,Fernando Rossini,Argentina,"Ya en la etapa final del segundo disco, y con tu aporte podremos fabricarlo en formato físico!",4412,33,3000,31,Música
1313,DENSIDAD 7850,Denise Koziura,Argentina,Participación en libro fotográfico colectivo.,3268,33,1100,13,Artes visuales
1314,SER LUTHIER - DOCUMENTAL,victoria77,Argentina,Un recorrido por talleres de los artesanos de la música. Descubriendo a las personas detrás del oficio de ser luthier.,4314,33,10200,51,Cine y video
1315,BAILA COMO QUIERAS,Colectivo Gamera,Chile,Un espacio para bailar libre junto a personas de todas las edades,14300,33,4600,17,Artes escénicas
1316,¡¡ESTRENAR EN CORRAL AJENO!!,En Corral Ajeno,Argentina,"Espectáculo teatral protagonizado por Mijal Katzowicz, con dramaturgia y dirección de Soledad Manes.",2322,33,6000,222,Artes escénicas
1317,LA CALLE - RAFAEL CALVIÑO,Plata Negra Ediciones,Argentina,Libro de fotografías de Rafael Calviño con prólogo de Horacio González,19559,33,5100,71,Editorial
1318,CORTOMETRAJE MORTIS: DANTE,Arcano IV,Chile,"""DANTE"" es un cortometraje adaptado de la novela gráfica In Absentia Mortis, Producido por Arcano IV producciones.",11440,33,7200,12,Cine y video
1319,FATUM,Mano a Mano,Argentina,Miniserie Argentina,4297,32,8900,21,Cine y video
1320,FAVIO: CRÓNICA DE UN DIRECTOR,Producciones2t,Argentina,"Narrar la pasión, la memoria.",3766,32,10800,24,Cine y video
1321,7 SEMANAS,Valentina Roblero Arellano,Chile,"7 Semanas es un largometraje que cuenta la historia de Camila, una joven estudiante de Danza, quién está embarazada y decide abortar.",15158,32,6800,14,Cine y video
1322,CAER DEL TIEMPO,Ian Quintana,Argentina,"Cortometraje sobre la fugacidad de la existencia, sobre el devenir de los momentos y sobre cómo cada gota de agua se diluye en el Tiempo.",2655,32,4900,17,Cine y video
1323,CAMARERAS MUSICALES,Pablo Murphy Figueroa,Argentina,Un musical para toda la familia que nos enseña el valor de la amistad y a creer en nuestros sueños.,1046,32,2000,11,Artes escénicas
1324,LA VIDA A CUENTAGOTAS LIBROS,Marcia,Argentina,"La vida a cuentagotas es mi sueño por cumplir, por eso necesito que te unas, te doy mi voz, mi mirada y espero que vuelvas en palabras",7206,32,27000,39,Editorial
1325,¡AMISTAD A NUEVA YORK!,Tarix Sepulveda,Chile,Necesitamos tu ayuda para viajar a Nueva York a exhibir nuestras publicaciones con jóvenes artistas y escritores en el NY Art Book Fair,22909,32,8700,72,Editorial
1326,ANDANDO Y SOÑANDO,rome96,Argentina,"Una charla entre corazones, una incitación a renacer, una apología de los sueños, un viaje sin regreso… quedan lugares, yo invito... ¿venís?",1291,32,2500,24,Editorial
1327,BRUNDIBÁR,maxnordau,Argentina,La representación de Brundibár apunta a mantener viva la memoria del Holocausto.,3170,32,3100,14,Artes escénicas
1328,DE MIS OJOS A LOS TUYOS,Andrea Ch Almazán,México,Pequeños Jardines a cambio de la operación para mis ojos,32600,32,2400,25,Artes visuales
1329,PAN Y CIRCO,Adriana Sánchez,México,"Documental que muestra la vida detrás de escena de los artistas que conforman los circos; sus dificultades, oportunidades y sacrificios",1300,32,572,2,Cine y video
1330,MITOLOGÍA,Orangutanes de Borneo,Chile,Mitología es un proyecto de investigación y creación escénica en torno a la existencia de una agrupación teatral croata a comienzos del s XX,9152,32,807,6,Artes escénicas
1331,SOEMA MONTENEGRO. TERCER CD.,Soema Montenegro,Argentina,Soema Montenegro grabó su tercer disco y necesita tu colaboración para poder presentarlo en sociedad.,2681,32,8200,43,Música
1332,GRAMONAUTAS PRIMER DISCO,gramonautas,Argentina,"Estamos terminando el proceso de grabación de nuestro primer disco de larga duración, para lo cual pedimos tu participación y ayuda!",3059,32,5600,132,Música
1333,ALE TORRIGGINO + ONCE GUITARS,gonzaloesteybar,Argentina,"Buscamos colaboración para poder editar dos nuevos discos de estos dos artistas, de forma independiente. Ayudanos a cumplir el objetivo!",3203,32,4300,23,Música
1334,VIAJE A CONGRESO EN ESPAÑA,Paul Wegmann,Brasil,El proyecto tiene por objetivo levantar fondos para viajar a España a presentar un artículo que ha sido aceptado en un congreso.,9099,32,1200,8,Música
1335,PARTE DE LA NADA | FER ROMERO,F E R R O M E R O,Argentina,SEGUNDO DISCO SOLISTA DEL MÚSICO Y COMPOSITOR FER ROMERO. LO MANDAMOS A EDITAR Y LLEGA A TUS MANOS,4824,32,6300,47,Música
1336,1º CD ENRIQUE HUERTA QUINTETO,Enrique Huerta,Uruguay,"Primer CD ""Cuestión de tiempo"" Con tu colaboración realizaremos el arte gráfico y los CDs. Se parte y recuerda que vuelve todo lo que das..",6429,32,5400,6,Música
1337,LA DESGRACIA BANDA SONORA,Enrique Jauregui,Argentina,La desgracia llegó!!! y necesitamos tu ayuda para poder materializar la grabación de nuestra banda de sonido. Gracias por acompañarnos!!!,10670,32,3400,45,Música
1338,TAN LEJOS DEL SUELO,La Marmita,Uruguay,"Tan lejos del suelo es el el segundo disco de La Marmita. Con viento en la camiseta, la banda está armando un album mucho más rockero.",17447,32,3300,45,Música
1339,LA GENTE ANDA DICIENDO 2,Bureau de Juegos,Argentina,Llega el libro 2 de La Gente Anda Diciendo y en este Ideame lo vas a poder comprar a un precio especial.,5183,31,26200,87,Editorial
1340,LIBRO DE ''LA LLAVE'',Ramiro GM,Argentina,"Tomo unitario de una historia llena de acción y aventuras del creador de ""mosquito mutante"" en compañía de la liga del fanzine",1529,31,2500,16,Editorial
1341,LA JUGUERA MAGAZINE,Alejandra Delgado,Chile,"Campaña para financiar las próximas ediciones de LA JUGUERA MAGAZINE, revista cultural impresa de distribución gratuita hecha en Valparaíso",29859,31,14600,65,Editorial
1342,JUAN ARABEL - VIDEO CLIP,Juan Arabel,Argentina,"Hola! Soy Juan Arabel y hago música Argentina. Con mi banda Necesitamos de TU COLABORACIÓN para terminar de filmar nuestro video, GRACIAS!",824,31,2500,13,Cine y video
1343,ATÁVICA DOCUMENTAL,cinedisidente,Chile,"Atávica es una película etnográfica-experimental filmada en la Cuenca de Los Choros, en el norte semiárido de Chile.",31661,31,5800,29,Cine y video
