,Proyecto,Autor(a),País,Descripción,Recaudación,Porcentaje,Vistas,Colaboradores,Categoría
834,"¡SÚMATE AL DISCO ""RAÍZ""!",Andrea Andreu Muñoz,Chile,"Súmate a esta campaña y ayúdanos en el montaje final, a difundir y crear el primer video clip de mi segunda producción discográfica: ""Raíz""",48678,91,8500,58,Música
835,FELI PRIMER DISCO!!,Feli Colina,Argentina,"Hola!! Ya estamos terminando la grabación. Ahora necesitamos mezclar, masterizar y replicar los discos para que lleguen a tus manos!!",10629,90,13500,1793,Música
836,DISCO HITS 90S EN ESPAÑOL,Borsalino,Argentina,¡Hola! Creamos este Ideame para poder grabar nuestro nuevo disco. ¿Nos ayudás?,11765,90,1200,49,Música
837,"EMPUJANDO LÍMITES, EL CRUCE.",lazonamagica,Argentina,Documental sobre un padre y su hijo con autismo que se lanzan a la aventura de cruzar la Cordillera de los Andes en tándem.,53072,90,4800,131,Cine y video
838,"ESTRENO ""SANRAFA""","""La Cancha Teatro""",Chile,"""San Rafael, el Misterio de los Atorrantes"" obra de teatro que estrena el 25/9/2015. Ayúdanos con su realización.",57859,89,4600,19,Artes escénicas
839,LOOPTOPÍA,LOOPTOPÍA,Argentina,Obra de teatro/performance independiente producto de nuestra labor profesional en la búsqueda de superar (nos) límites escénicos.,14641,89,3900,68,Artes escénicas
840,MANIFIESTO A TUE TUE,TURBOCRISTO RECORDS,Argentina,"SOy Olonés y Bank Robber crearon este Manifiesto. Ya está escrito y diseñado, pero falta editarlo físicamente. ¡Te necesitan para hacerlo!",378,88,1800,6,Editorial
841,"CORTOMETRAJE ""BARRIO CERRADO""",Huayra,Argentina,"Barrio Cerrado es un cortometraje independiente que narra el encuentro entre 2 jóvenes de distintos mundos, en un sofocante día de verano.",3775,88,9300,18,Cine y video
842,LOS TABALEROS - TUY,pablo999,Argentina,"Grabación y presentación de nuestro nuevo álbum ""TUY"".",11569,88,11000,1733,Música
843,"PRIMER ÁLBUM DE ""ROUS""",rosario,Chile,"Con tu ayuda podré grabar y producir en Los Ángeles, California mi primer álbum. Si crees en ""ROUS"", ayúdame!",151383,88,17500,150,Música
844,CADA DÍA PESA,Cada día pesa,Chile,"Somos estudiantes de Comunicación Audiovisual de Duoc UC, y estamos en la etapa de comercialización y distribución de nuestro cortometraje",7579,88,2300,15,Cine y video
845,ANUARIO DE ILUSTRADORES 2015,Anuario Ilustradores,Argentina,"¡Aquí otra vez! En este, nuestro 9º año consecutivo, buscamos editar un libro enorme, a todo color, con dos super desplegables. ¿Nos ayudás?",57865,87,28400,717,Editorial
846,( G U A T A C A ) 2.0,Catalina de la Parra,Chile,"( g u a t a c a ) 2.0, basado en un hecho real es el quinto montaje de Catalina de la Parra. Temporada desde el 8 al 24 de Agosto.",37610,87,5000,43,Artes escénicas
847,34 PUÑALADAS. ÁLBUM 6.,34 Puñaladas,Argentina,34 Puñaladas cumple 15 años y lo festeja grabando su sexto disco de estudio. Tu colaboración es importante para hacerlo realidad,8611,87,12500,92,Música
848,¿JUGÁS?,Fremdina Bianco,Argentina,Un cortometraje que busca quebrar las fronteras entre el bien y el mal en el mundo de la infancia.,4226,86,8100,296,Cine y video
849,"REINA, UNA NUEVA LÍDER.",Facundo Suarez,Argentina,"Obra teatral de Marcelo Camaño. Actúan: Sabrina Zelaschi, Luciana Cruz, Victoria Baldomir, Nahuel Kreser. Dirección: Facundo Suarez.",3935,86,8800,47,Artes escénicas
850,PROYECTO PURA,PURA,Argentina,"Queridísimos!! Con sus aportes, nos ayudarán a costear vestuario, utileria, maquillaje, peluquitas nuevas, gráfica y mucho más! Gracias!",1699,86,2900,13,Artes escénicas
851,LIBRONGO II,Robertita,Argentina,"Librongo es un libro para colorear, para todo público, que va a ser DONADO a pacientes niños y adultos mayores",19807,86,21000,202,Editorial
852,EL SUEÑO DE ÍCARO,Brebre,Argentina,"El primer libro de historieta de Brebre, una historia real contada con fantasía.",19706,86,14000,99,Editorial
853,MOMBYRY,Fremdina Bianco,Argentina,Gladys decide abandonar su vida en el interior del país en búsqueda de un futuro mejor en la gran ciudad.,7059,86,8200,217,Cine y video
854,PASTEL DE CEREZA,Jessica Praznik,Argentina,Segundo cortometraje de LA FABRICA DE TORTAS,1686,86,11200,219,Cine y video
855,NOVEDADES MATUTINAS,Joaquin Navarro,Chile,"Estamos en proceso de grabación de nuestro primer disco, necesitamos apoyo en su financiamiento, TODO ES DEMASIADO CARO.",36752,85,4300,50,Música
856,"DINOVO VA A CHACHAPOYAS, PERÚ!",Camilo Herrera,Chile,Me invitaron a participar en el Festival de Arte Contemporáneo Chachapoya 2017 y necesito financiar el pasaje de ida y vuelta Santiago-Lima,4862,85,1300,14,Música
857,FUERA DE JUEGO,FUERA DE JUEGO,Argentina,Somos alumnos de la Universidad Nacional de las Artes y nos encontramos realizando un corto de 12 minutos de duración.,1402,85,4800,144,Cine y video
858,LOS PENÚLTIMOS DÍAS,Penúltimos Films,Argentina,Relato de una separación: Blas y Andrés ensayan la despedida en medio de días tristes y noches de insomnio.,3627,85,3600,24,Cine y video
859,CIERVO PIE BLANCO,CIERVO PIE BLANCO,Argentina,"Danos envión para hacer esta experiencia teatral, que pulsa lo irreversiblemente animal que somos y de la fuerza contradecida que lo oculta.",5523,84,2100,19,Artes escénicas
860,LA MUJER ROTA,Alexandra Smith,Chile,"Obra de Teatro Dirigida por Raúl Osorio, actrices Gabriela Robledo y Alexandra Smith y dramaturgia de Marco Antonio de la Parra.",12012,84,1800,17,Artes escénicas
861,V.D.V GRABA NUEVO EP !,Víctima del Vaciamiento,Argentina,"Proponemos una unión de fuerzas en pos de esa manifestación ""pasada de moda"" llamada R'n'R. Ayudanos a que las cosas sigan pasando!",2745,84,1700,16,Música
862,SAVIA,SAVIA Cultural,Argentina,"SAVIA será un espacio cultural independiente para artes escénicas y visuales, clases, charlas, exposiciones y gastronomía.",41177,84,1900,72,Artes escénicas
863,CÁMARAS OCULTAS,JodasArgentas,Argentina,"Grupo de 7 jóvenes actores con ganas de hacer reír a la gente. Cámaras ocultas y bromas en Buenos Aires. Cuidado, ¡podés ser la víctima!",6884,84,26000,1913,Cine y video
864,UNA NUEVA WEB PARA EL ÁRBOL!,Proyecto El Árbol,Chile,"El Árbol no es solo una revista, sino una instancia colaborativa para el desarrollo y la comunicación de ideas.",48364,84,23000,53,Editorial
865,ROSS Y GUIL,Lucas Figueroa,Chile,"Montaje de egreso 2017, de las carreras de Actuación y Diseño Teatral de la Universidad de Chile",11984,83,5200,18,Artes escénicas
866,AVESTRUZ - CORTO DE FICCIÓN,Avestruz,Argentina,"El relato de un joven adicto, torturado por demonios del pasado, mientras está recluido a la fuerza en un centro clandestino.",2712,83,4000,15,Cine y video
867,LOS HIJOS DEL CARNAVAL,Mandinga Cine,Argentina,"Somos un grupo de estudiantes de la carrera Diseño de Imagen y Sonido de la Facultad de Arquitectura, Diseño y Urbanismo de la UBA.",6850,83,10900,1182,Cine y video
868,"YO, LUCAS","Yo, Lucas",Argentina,"Ayudanos a finalizar este hermoso proyecto, sé parte de esta fabulosa Serie Web y ganá importantes premios.",2729,83,3300,6,Cine y video
869,ARTE DE NOCHE AZUL,Arte de Noche Azul,Argentina,Si toda una comunidad apuesta a la cultura no hay límites para seguir creciendo. Sé parte de esta red de arte colaborativo e independiente.,19003,83,3600,74,Artes visuales
870,NO SOY EL MEJOR DEL MUNDO,abriones,Chile,"Se parte de la grabación del disco de la banda La Volantín, música consciente y consecuente. ¡Pónele más hilo al carrete pa que vuele!",71788,83,5600,57,Música
871,SIN SOLEDAD - LARGOMETRAJE,varangov,Chile,"Una casa, dos viejos sin Soledad. ¡Apóyanos para el desarrollo de esta película!",70501,82,3100,66,Cine y video
872,CRÓNICAS DE J. W. BØKGAARD,Javier Giangreco,Argentina,Primer libro de relatos de estos nóveles autores. Si te gusta leer a Borges o a Cortázar... ¡leélos!. Ellos se perdieron estas Crónicas...,4714,82,2300,19,Editorial
873,¡LA CRIATURA TE NECESITA!,Yeannoteguy,Argentina,"""La criatura aprende a hablar"" es un concierto itinerante para voz hablada y cantada. Para completar nuestro trabajo ¡necesitamos tu ayuda!",2949,82,2300,19,Artes escénicas
874,SERENDIPIA: LA PREVENTA,CaroMalet,Argentina,Con tu colaboración voy a poder financiar la publicación de mi primer libro que se fue escribiendo durante cinco años alrededor del mundo.,18644,81,3200,82,Editorial
875,BUENOS AIRES PARA (DES) ARMAR,FERA,Argentina,"Es un journal para mujeres 100% ilustrado, con recomendaciones y actividades para que recorrer la ciudad sea un ejercicio inspirador.",22468,80,10700,92,Editorial
876,NATUS VINCERE CORTO DE TERROR,Luis Lambert,Argentina,Un cortometraje de terror - Accion realizado por estudiantes de cine de la UNC inspirado en el trabajo de George Romero y Genndy Tartakovsky,7846,80,1700,11,Cine y video
877,VEINTICUATRO,veiticuatro Fav,Argentina,VEINTICUATRO es una instalación desarrollada por jóvenes arquitectos argentinos que fue seleccionada para participar del #FAVMTP2016,18252,80,14500,38,Artes visuales
878,ILUSTRACIONES - LEONARDO GAUNA,Leonardo Gauna,Argentina,Editar un libro con ilustraciones y trabajos de los últimos 10 años.,17141,80,4800,83,Artes visuales
879,PRIMER DISCO DE ENCABRITADOS,Encabritados,Argentina,"Terminamos de grabar, mezclar y masterizar nuestro primer disco. Ahora necesitamos de tu colaboración para realizar la edición fisica.",4477,80,2900,42,Música
880,CINE AURIDESCRIPTIVO,Maximiliano Pinela,Argentina,Mediante AURICULARES INALAMBRICOS reuniremos en la misma sala de cine al espectador común y al espectador ciego para una función inclusiva.,2614,80,4100,26,Cine y video
881,COSECHA DE PAPEL,Agustin Hoyos,Colombia,"Antonio, un cultivador de maíz que se ve forzado a tomar una decisión por conservar sus principios dentro de un mundo de ilegalidad.",16807,80,10600,74,Cine y video
882,INDELEBLE,metropoliscine,Argentina,"Una joven trabajadora social, madre, y una vida marcada por el abuso sexual, las drogas, la prostitución; y un presente de resiliencia",18235,79,2100,70,Cine y video
883,RUGE EL MAR,Noir Cine,Argentina,"Un documental en el que Patricia vuelve a su pasado invisibilizado, a un lugar frío, donde su historia se transforma en nuestra historia.",7762,79,6800,51,Cine y video
884,"""UNA PRESENCIA PROTECTORA""",La Lulu Bonato,Argentina,"Eligo a diez personas, por medio de una invitación abierta, para tatuarles un símbolo que diseño en función de una entrevista individual",907,79,1500,9,Artes visuales
885,LA MALASANGRE - OBRA DE TEATRO,La Malasangre - Obra de Teatro,Argentina,"La pasión de un amor prohibido y diferente, que es un clásico del teatro Argentino. Escrita por la gran Griselda Gambaro.",2552,78,17300,163,Artes escénicas
886,POEMARIO DE AUTORAS JÓVENES,Liberoamerica,Argentina,"Queremos publicar una antología poética con 80 poetas jóvenes de toda América Latina, Portugal y España.",15399,78,6600,75,Editorial
887,SU PROPIA OTRA,Su propia Otra,Argentina,Somos un grupo de curadores del CIC con una exposición en mente. Nos ayudas a hacerla realidad? Entrá y enterate cómo podés hacerlo!,1788,78,4200,89,Artes visuales
888,EL FUNERAL DEL SOL,Adrián Milano,Argentina,"Este será mi segundo libro de poemas, en el cual, el romanticismo sombrío se convierte en un irreversible olvido.",1765,77,1400,8,Editorial
889,PERIODISMO DE AVENTURAS,Diego N. Accorsi,Argentina,"Libro que recopila mis mejores notas y entrevistas durante 30 años como periodsita de cómics, MAS UN MONTON DE NOTAS Y REPORTAJES INEDITOS!",8869,77,3000,50,Editorial
890,THE SEARCH 3: THE HYPOTHESIS,Benjamín Lechuga González,Chile,"Busco recaudar fondos para poder lanzar el disco y el documental ""Making off"" de mi disco solista: ""The Search Part 3: The Hypothesis""",77565,77,13100,115,Música
891,EL LIMONERO. BIO/LOGÍA 3,Eugenia Hadandoniou,Argentina,"Necesitamos recaudar fondos para realizar un objeto gráfico, que se entregará en la función, una casa para armar con los personajes.",1324,77,2700,13,Artes escénicas
892,FLUIR,Araceli Bonfigli,Argentina,FLUIR. Disco de Araceli Bonfigli. Compositora y escritora. Sus canciones buscan crear paisajes y sensaciones como devenir de los días.,3775,77,4800,41,Música
893,¡SÉ PARTE DE EL ESTEPARIO!,El estepario Teatro,Argentina,El Estepario teatro es un espacio fundado por y para creadores. Nuestra principal actividad es fomentar las artes escénicas,3775,77,6600,40,Artes visuales
894,"LAS NOCHES SIN LLUVIA, FILM",La Tina Prod,Argentina,"Pelicula psico-dramática basada en obra de teatro-danza ""No serás Luna""",7490,76,9100,835,Cine y video
895,EL UMBRAL - CORTOMETRAJE,Ariadna Cabrera,Argentina,"Narra el encuentro de dos errantes en una historia sobre la misteriosa naturaleza humana, la soledad y la desorientación (10' aprox)",1876,76,6800,75,Cine y video
896,"NEHUEN, EL NIÑO Y EL MAR",EmiDesouches,Argentina,"Corto de ficción que, desde el realismo mágico, nos cuenta la búsqueda e inocencia de un niño ante una dura realidad que se le presenta.",9902,75,1900,24,Cine y video
897,ULTIMO PISO - CORTOMETRAJE,alejandromarcast,Argentina,"Cortometraje independiente sobre la política, la inseguridad, la diversidad ideológica y algo trascendente: la gente en situación de calle",1242,75,6800,84,Cine y video
898,PABLO MORO TANGO ÁLBUM FÍSICO,Pablo Moro,Argentina,"luego de grabar,mezclar y masterizar mi álbum de guitarra solista de tango, necesito editar el disco físico y realizar un show presentación.",13481,75,1500,41,Música
899,¡WACHÚN SE VA A ARGENTINA!,Wachún,Chile,¡Amig@s de Wachún! Necesitamos de tu ayuda para crecer y poder viajar a Argentina y participar en el 13º Encuentro de la Canción Infantil,38725,75,4000,48,Música
900,DISCO UMBRAL DÚO DE GUITARRAS.,sebastian segarra,Uruguay,Ya esta recién terminado nuestro disco UMBRAL dúo de GUITARRAS Ayúdanos para poder Editarlo... GRACIASSS!!!,14113,75,6600,9,Música
901,"LAS DIVAS, ¡JUEGO DE CARTAS!",medinagouguet,Argentina,¡El primer juego de mesa argentino basado en el maravilloso y sorprendente mundo de las Drag Queens!,12343,75,5600,47,Juegos
902,LAS GUARDIANAS,Pablo D'Elía,Argentina,"Las Guardianas, Comedia negra de Hernán Costa con dirección de Pablo D’Elía. Actúan: Maiamar Abrodos, Emiliano Figueredo y Jorgelina Vera.",2451,75,3900,35,Artes escénicas
903,2DO DISCO DE PANCHO DOMÍNGUEZ,Francisco Dominguez,Chile,Hola!! te invitamos a apoyarnos en este segundo disco que saldrá en Marzo del 2015.,38554,74,4500,63,Cine y video
904,ENCUENTRO DE DIRECTORAS,Escena Propia,Argentina,Encuentro de directoras escénicas que se reúnen a repensar sus prácticas desde una perspectiva de género y político territorial.,18301,74,6900,139,Artes escénicas
905,LA LEY PRIMERA,La Ley Primera,Argentina,"Somos un grupo de estudiantes de Diseño de Imagen y Sonido (FADU - UBA) La Ley Primera, es nuestra tesis final de la carrera",5301,74,6700,266,Cine y video
906,DISCO PROVINCIANO NAHUEL JOFRÉ,Santiago Nahuel,Argentina,"Editar un nuevo disco de mis canciones: ""Provinciano"". Masterizar, diseñar, editar mil réplicas fisicas y distribuirlo en las plataformas.",19379,74,3200,79,Música
907,13 · RODOLFO MEDEROS ORQUESTA,Rodolfo Mederos,Argentina,"La Orquesta Típica cumple 13 años y está lista para grabar su tercer cd. Es un proyecto costoso, por eso necesitamos tu ayuda",70621,74,20200,135,Música
908,BÁRBARA GILLES / NUEVO DISCO,Bar Gilles,Argentina,Estoy en plena grabación de mi segundo disco de estudio. ¡Con tu ayuda voy a poder terminarlo!,12092,74,2500,70,Música
909,LA PUTA TRISTE EN VALPARAÍSO,Mila Corona Lorca,Chile,"Un montaje que pretendemos presentar en el mes de Julio por los bares de Valparaíso, para acercar el teatro a la gente.",4233,74,2800,14,Artes escénicas
910,HECHOS CONSUMADOS.,Hechos Consumados,Argentina,H.C. se proyecta como una serie web policial escrita y dirigida por Carolina De Luca y protagonizada por Lucrecia Gelardi.,7190,73,11100,1225,Cine y video
911,LAS VOCES DEL RÍO,Martín Paglione,Argentina,Creemos en el teatro como una herramienta para la transformación social y necesitamos de tu colaboración para llevar a cabo nuestro proyecto,4832,73,7900,29,Artes escénicas
912,TORTUGAS EN BRAILE PARA NIÑOS,Dianna del Pilar,Colombia,Diseño y edición de un cuento corto sobre las tortugas Laud para niños con discapacidad visual o baja visíón.,4862,73,15100,7,Editorial
913,AGUA EN LA CABEZA,Club Hem,Argentina,"A un año del 2 de abril en La Plata queremos publicar un libro que reúne relatos, crónicas, poemas e ilustraciones sobre la inundación.",3856,73,8800,60,Editorial
914,"LDN NUEVO ""EP""",LOCOS DE NACIMIENTO,Argentina,QUEREMOS QUE SEAS PARTE DEL NUEVO MATERIAL DISCOGRÁFICO! NUESTRO 7MO MATERIAL,14494,73,1800,43,Música
915,"""BAHIA"", DISCO DE LA ALEGRÍA",Maria Constanza,Argentina,"Necesito de tu ayuda para editar mi primer disco autoral de estudio en portugués y castellano:""Bahia"", y así podamos disfrutarlo!! Alegria!",5010,73,5000,105,Música
916,DESAHOGO,Tamarindo,Argentina,Somos un grupo de estudiantes de Diseño de Imagen y Sonido (FADU - UBA) realizando el corto final de segundo año.,2356,72,9300,305,Cine y video
917,ROMPECABEZAS,Cortado a Cuchillo,Argentina,Somos estudiantes de imagen y sonido (UBA) y nos es imprescindible tu ayuda para poder financiar nuestro proyecto final de segundo año!,2837,72,7500,655,Cine y video
918,RARA AVIS: LIBRO ÁLBUM,María Aranguren,Argentina,"Un libro con aires de enciclopedia, pizca de poesía, intimidades de diario e ilustraciones en tinta china. ¡Ayudanos a publicarlo!",28252,72,7000,160,Editorial
919,CRUZ CORTOMETRAJE,GabrielaE,Argentina,"La historia de un padre y una hija, su distancia y su cercanía, un reencuentro familiar cargado de historia.",2974,72,2700,19,Cine y video
920,SALTO CÓSMICO,Maia Morea,Argentina,Sé parte del SALTO! Ya estamos grabando y en Agosto presentamos las canciones! Compra anticipadamente el EP y las entradas de los shows.,11886,72,4200,54,Música
921,HISTORIAS DE AMOR BAJO LLUVIA,carolinaperrotta,Argentina,"Una comedia (no) romántica con banda ao vivo. Estreno: Febrero 2015. 4 historias, 8 personajes y una estética muy hipster.",3529,72,5600,38,Artes escénicas
922,SÉ EL PUENTE!,lechuga cósmica,Argentina,"Busco cómplices, para seguir adelante con este proyecto de crear puentes entre las palabras impresas y los ojos que las lean .",1183,72,3100,29,Editorial
923,VIAJANDO DESPIERTO,mer_lara,Argentina,Un libro para colorear para adultos que libera tu creatividad sobre Barcelona · Tokio · Berlín · Buenos Aires · San Francisco.,7876,71,7800,189,Diseño
924,MIENTRAS SE ESPERA,paolavillabida,México,"Documental que cuenta la historia de 5 mujeres en un asilo, de donde no salen y donde nadie las visita, excepto sus fantasmas del pasado",50200,71,13500,48,Cine y video
925,SANTULLO GRABA SU NUEVO DISCO,Fernando Santullo,Uruguay,"Producción de ""El mar sin miedo"", nuevo disco de Santullo, autor de los temas de Bajofondo El mareo (cantada por Gustavo Cerati) y Lluvia.",66790,71,16800,153,Música
926,CRÓNICAS DEL CIELO Y LA TIERRA,TantaAgua editorial,Argentina,"El nuevo libro de Mariano Ribas. Los fenómenos del cielo que cambiaron el rumbo de la humanidad, de la estrella de Belén al Titanic.",35229,71,14100,209,Editorial
927,MANAL JAVIER MARTINEZ-CD NUEVO,Fabio Scaturchio,Argentina,"El nuevo CD Manal Javier Martínez, el pionero del rock nacional, con temas inéditos. Edición limitada. Venta anticipada.",2330,71,5600,25,Música
928,"""MOIRAS"" OBRA TEATRAL",Julia Di Ciocco,Argentina,Un proyecto cultivado entre mujeres para tejer redes y buscar desde el teatro herramientas de visibilización de la violencia de género,6961,71,2600,35,Artes escénicas
929,DINOSAURIOS DE PAPEL P/ ARMAR,Guardabosques,Argentina,Queremos financiar el lanzamiento de una colección de 10 cráneos dinosaurios de papel para armar,11451,70,33500,366,Diseño
930,¡GIRA EUROPA Y ONE LOVE FEST!,Buenas y Santas,Argentina,Tocaremos en el One Love Festival en Inglaterra y giraremos por Europa. ¡No te pierdas la oportunidad de formar parte de Buenas y Santas!,13840,70,3800,76,Música
931,DISCO DEBUT DE JESSIE ROBINS,Cristóbal Bravo Rivas,Chile,Te invitamos a ser parte de este proyecto que nace por el amor a la música y por el sueño de 3 pibes relocos,48049,70,6800,34,Música
932,ACAPULCO,Lucila Pace,Argentina,"El largometraje ""Acapulco"" es el proyecto final de la carrera de Diseño de Imagen y Sonido a filmarse durante el verano 2014 - 2015",3415,69,9800,491,Cine y video
933,REBOBINADO LA PELICULA,Juan Francisco Otaño,Argentina,"La música te transportara al recuerdo, queda en vos cambiarlo",11389,69,13300,73,Cine y video
934,"LA FIRULATA, EL DOCUMENTAL",kika,Argentina,"Somos La Firulata, una escuela de circo ubicada en Chacabuco, Buenos Aires, Argentina y queremos hacer un documental",7958,69,9600,43,Cine y video
935,"""PRESENCIA"" A FESTIVALES",DiegoValdesR,Chile,"""Presencia"" es un corto que habla de límites y salud mental, de actuación y de libertad, todo hecho en toma continua y Puedes verlo Aquí!",29602,69,1400,16,Cine y video
936,TODO LO QUE PUEDE EL VIENTO,Todo lo que puede el viento,Argentina,"Cortometraje de ficción que habla sobre la identidad y la memoria, realizado por estudiantes de Diseño de Imagen y Sonido de la UBA.",11307,69,2900,37,Cine y video
937,CANCIONERO MUJERTROVA 2018,paulaferre,Argentina,"Edición del Cancionero MUJERTROVA 2018. Libro con letras, acordes y disco en mp3 de 45 compositoras de Argentina y otros países.",11291,69,6700,51,Música
938,CIRCO DEMENTE COBRA VIDA,Inmerso,Argentina,"El pasado 15/06 presentamos en las redes ""Circo Demente"" nuestro segundo disco de estudio. Ahora necesitamos tenerlo en nuestras manos!",7948,69,4200,68,Música
939,LOS CABALLEROS DE LA ROSA,jjconti,Argentina,"Editar e imprimir mi segundo libro de cuentos. Una vez impreso, estará disponible en Internet con una licencia Creative Commons.",16567,69,9700,26,Editorial
940,MEET THE GAME 2015,Ramza Pilgrim,Argentina,"MTG es un evento que reune a todos los juegos desarollados en Argentina durante un día completo. Ademas de charlas, talleres y mucho mas.",6806,69,16000,288,Juegos
941,ME VUELVO YOUTUBER POLÍTICO,Yamil Santoro,Argentina,Creo que hace falta generar un canal divertido y dinámico de análisis político. Me ofrezco a explicar lo que pasa: monólogos y entrevistas.,5686,69,12100,25,Cine y video
942,ARLT AL TEATRO,Fernando Santana,Argentina,Colectivo de artistas que busca llevar adelante la proeza de adaptar y llevar a escena Los siete locos y Los lanzallamas de Arlt,4444,68,6400,56,Artes escénicas
943,DIANA REGRESA TRAILER,vera,Argentina,Para darle difusión y lograr un mayor alcance de público de nuestra obra de teatro Diana Regresa queremos hacer un trailer.,1111,68,2300,14,Artes escénicas
944,MAREA MUERTA,rapsodiamacabra,Chile,"Un cortometraje que cuenta la historia de Enrique, un hombre que atraviesa distintos estados emocionales tras la muerte de su esposa.",11812,68,2800,18,Cine y video
945,CUANDO MI JEFE SE VA-SERIE WEB,CuandoMiJefeSeVa,Argentina,"Un grupo de oficinistas que hace de todo en su trabajo, menos trabajar. Y vos ¿qué hacés cuando tu jefe se va? Realizado para la U.N.A",2683,68,6000,162,Cine y video
946,IMAGINARIO BARROCO EN ESPAÑA,Imaginario Barroco,Argentina,Fuimos seleccionados para ser artistas residentes en el 'ECOS - Festival Internacional de Música Antigua de Sierra Espuña' en España,6699,68,3900,34,Música
947,ME LLEVA LA JARANA EN EUROPA,Me Lleva la Jarana,Argentina,A partir del 30 de Marzo de 2019 emprenderemos una gira por Europa para llevar nuestro espectáculo a nuevos lugares y espectadores/as,15556,68,2900,35,Música
948,FEDE BLOIS / DISCO + VIDEOS,fede blois,Uruguay,El disco se grabó entre junio y setiembre de 2016.Hoy el proyecto se encuentra en su etapa final:edición y realización audiovisual.,16327,68,5400,39,Música
949,"NUEVO ESPECTÁCULO ""CÓDIGOS""",Murga La Quetejedi,Argentina,"Somos “La Quetejedi”, una murga uruguaya de Berazategui y estamos armando nuestro nuevo espectáculo “Códigos”. ¿Nos ayudás?",10062,68,7300,54,Artes escénicas
950,ALEGRÍA!,alegriapolitica,Argentina,Libro recopilatorio de los primeros 365 días de Alegría!,24170,67,28100,245,Editorial
951,DESTIEMPO,Wann Teems,Argentina,"Cortometraje a realizarse en Buenos Aires, formato digital RED WEAPON, Dirigido por Wann Teems, con equipo técnico de Universidad del Cine.",2206,67,1700,12,Cine y video
952,BAJO CONTROL CORTOMETRAJE,mattiaspagani,Argentina,"Walter, un científico reconocido, decide detener a Víctor, un científico renegado que experimenta con los sueños de las personas.",2190,67,1900,14,Cine y video
953,PRIMER DISCO DE FRANCIS,Francis,Chile,"Desde 2009, FRANCIS está concentrada en crear canciones y sumar experiencias en distintos escenarios, para ser plasmadas en un disco.",38554,67,9000,18,Música
954,CONTRAFASE,CONTRAFASE,Argentina,"Película documental realizada en Río Grande, Tierra del Fuego, Argentina.",4412,67,9100,299,Cine y video
955,SUEÑOS DE FAMILIAS,Cien Lunas,Argentina,"LIBRO ILUSTRADO PARA NIÑOS NACIDOS POR TÉCNICAS DE REPRODUCCIÓN HUMANA ASISTIDA. ESTA VEZ, PARA TODOS LOS TIPOS DE FAMILIAS, POR CIEN LUNAS.",9877,67,12100,74,Editorial
956,"IKIGAI, CORTOMETRAJE",Fernanda Guerrero V,Argentina,"Cortometraje experimental de danza teatro y ficción. Se centra en el camino hacia los sueños, el propósito de vida.",5724,66,5200,28,Cine y video
957,HIDA - CORTOMETRAJE,julia Riva,Argentina,"Seleccionado para realizarse por la Universidad del Cine, trata sobre el amor, la amistad y el despertar a la vida, sumate y ayudanos!",5962,66,5900,103,Cine y video
958,BOLSA DE GÉNERO,Communitas Consultora,Chile,"""El juego de género"" que busca educar mediante una trivia de preguntas y respuestas sobre feminismos, sexualidades y, por supuesto, género.",38025,66,5800,106,Juegos
